{
  "v": 1,
  "subject": {
    "type": "CAPABILITY",
    "deviceId": "dev_example",
    "hostId": "claude",
    "hostVersion": "0"
  },
  "state": "HOOK_OBSERVED",
  "source": "CT_OBSERVED",
  "trust": "HIGH",
  "selfReported": false,
  "hostRealVerified": false,
  "observedAt": "2026-09-27T00:00:00Z",
  "expiresAt": "2026-09-28T00:00:00Z",
  "ref": "receipt:example"
}
