{
  "v": 1,
  "subject": {
    "type": "EVENT",
    "eventId": "evt-example"
  },
  "state": "DECISION_COMPUTED",
  "source": "ENGINE",
  "trust": "MEDIUM",
  "selfReported": true,
  "hostRealVerified": false,
  "observedAt": "2026-09-27T00:00:00Z",
  "expiresAt": null,
  "ref": "receipt:example"
}
